{
  "$schema": "https://json-schema.org/draft/2020-12/schema",
  "$id": "https://github.com/MobilityDB/MEOS-API/blob/main/meta/temporal-covering.schema.json",
  "title": "Temporal-covering descriptor — canonical SoT",
  "description": "Schema for `meta/temporal-covering.json` (RFC #870/#913, TemporalParquet 2.0.0 covering columns). Catches shape regressions earlier than the unit tests; validated as a test step in `tests/test_covering.py`.",
  "type": "object",
  "additionalProperties": true,
  "required": ["provenance", "version", "valueCodec", "metadataKeys", "classes", "notes"],
  "$defs": {
    "field": {
      "type": "object",
      "additionalProperties": false,
      "required": ["name", "sqlType", "accessor", "source"],
      "properties": {
        "name":     {"type": "string", "pattern": "^[a-z][a-z0-9]*$"},
        "sqlType":  {"enum": ["double", "int", "bigint", "timestamptz"]},
        "accessor": {"type": "string"},
        "source":   {"enum": ["box", "value"]},
        "when":     {"enum": ["hasZ"]}
      }
    },
    "fields": {
      "type": "array",
      "minItems": 1,
      "items": {"$ref": "#/$defs/field"}
    }
  },
  "properties": {
    "_comment": {"type": "string"},
    "provenance": {
      "type": "object",
      "additionalProperties": true,
      "required": ["rfc"],
      "properties": {
        "rfc":             {"type": "string"},
        "discussion":      {"type": "string"},
        "temporalParquet": {"type": "string"},
        "geoParquet":      {"type": "string"},
        "benchmark":       {"type": "string"}
      }
    },
    "version": {"type": "string"},
    "valueCodec": {
      "type": "object",
      "additionalProperties": true,
      "required": ["asHexWkb", "fromHexWkb"],
      "properties": {
        "asHexWkb":   {"type": "string"},
        "fromHexWkb": {"type": "string"},
        "note":       {"type": "string"}
      }
    },
    "metadataKeys": {
      "type": "object",
      "additionalProperties": true,
      "required": ["temporal"],
      "properties": {
        "temporal": {"type": "string"},
        "geo":      {"type": "string"}
      }
    },
    "classes": {
      "type": "object",
      "minProperties": 1,
      "additionalProperties": {
        "type": "object",
        "additionalProperties": true,
        "required": ["types", "coverings"],
        "properties": {
          "doc":  {"type": "string"},
          "srid": {"type": ["string", "null"]},
          "box": {
            "type": ["object", "null"],
            "required": ["type", "from"],
            "properties": {
              "type": {"type": "string"},
              "from": {"type": "string"}
            }
          },
          "types": {
            "type": "array",
            "minItems": 1,
            "items": {"type": "string", "pattern": "^t[a-z0-9]+$"}
          },
          "coverings": {
            "type": "array",
            "minItems": 1,
            "items": {
              "type": "object",
              "additionalProperties": false,
              "required": ["key", "column"],
              "oneOf": [
                {"required": ["fields"]},
                {"required": ["byType"]}
              ],
              "properties": {
                "key":    {"enum": ["bbox", "tspan", "vspan"]},
                "column": {"type": "string", "pattern": "^\\{col\\}_[a-z]+$"},
                "fields": {"$ref": "#/$defs/fields"},
                "byType": {
                  "type": "object",
                  "minProperties": 1,
                  "propertyNames": {"pattern": "^t[a-z0-9]+$"},
                  "additionalProperties": {"$ref": "#/$defs/fields"}
                }
              }
            }
          },
          "columns": {
            "type": "array",
            "items": {"$ref": "#/$defs/field"}
          }
        }
      }
    },
    "deferred": {"type": "object"},
    "notes": {"type": "array", "items": {"type": "string"}}
  }
}
