{
  "_comment": "Temporal-covering descriptor — the single codegen source of truth for projecting a MEOS temporal column into the covering columns of TemporalParquet 2.0.0. Every binding/engine generates the IDENTICAL covering schema from this mapping, so a temporal table prunes the same way on every platform (Iceberg manifest pruning + Parquet row-group min/max) with no spatial-aware engine. Each covering is a struct column at the root of the schema, named after its temporal column: `bbox` is a GeoParquet 2.0 bounding box column, and `tspan` and `vspan` are built the same way for the time and value bounds. Curated canonical data keyed by temporal-type FAMILY (a `class`), not per type — adding a type is one entry in its class. The canonical MEOS-WKB value column is unchanged and lossless; the covering columns are denormalised derivations of the value's bounding box.",
  "provenance": {
    "rfc": "MobilityDB RFC #870 (TemporalParquet) + #913 (Temporal Data Lake)",
    "discussion": "MobilityDB#861 (edge-to-cloud SQL portability: one query, three platforms)",
    "temporalParquet": "TemporalParquet 2.0.0 covering columns (github.com/MobilityDB/MobilityLakehouse/blob/main/spec/covering-columns.md)",
    "geoParquet": "GeoParquet 2.0 bounding box column, declared under covering.bbox (github.com/opengeospatial/geoparquet/blob/main/format-specs/geoparquet.md)",
    "benchmark": "MVB v3 — the scalar AND-chain on materialised covering columns prunes row groups identically to the spatial-aware path and ~10x faster, with no DuckDB spatial extension"
  },
  "version": "2.0.0",
  "valueCodec": {
    "asHexWkb": "temporal_as_hexwkb",
    "fromHexWkb": "temporal_from_hexwkb",
    "note": "The canonical MEOS-WKB stays the lossless value column (BLOB); covering columns are denormalised and never the source of truth."
  },
  "metadataKeys": {
    "temporal": "temporal",
    "geo": "geo"
  },
  "classes": {
    "spatial": {
      "doc": "Spatial temporal types — STBOX covering: a GeoParquet bounding box column, the time extent, and the SRID.",
      "box": {"type": "STBOX", "from": "tspatial_to_stbox"},
      "srid": "tspatial_srid",
      "types": ["tgeompoint", "tgeogpoint", "tgeometry", "tgeography", "tcbuffer", "tnpoint", "tpose", "trgeometry"],
      "coverings": [
        {"key": "bbox", "column": "{col}_bbox", "fields": [
          {"name": "xmin", "sqlType": "double", "accessor": "stbox_xmin", "source": "box"},
          {"name": "ymin", "sqlType": "double", "accessor": "stbox_ymin", "source": "box"},
          {"name": "zmin", "sqlType": "double", "accessor": "stbox_zmin", "source": "box", "when": "hasZ"},
          {"name": "xmax", "sqlType": "double", "accessor": "stbox_xmax", "source": "box"},
          {"name": "ymax", "sqlType": "double", "accessor": "stbox_ymax", "source": "box"},
          {"name": "zmax", "sqlType": "double", "accessor": "stbox_zmax", "source": "box", "when": "hasZ"}
        ]},
        {"key": "tspan", "column": "{col}_tspan", "fields": [
          {"name": "tmin", "sqlType": "timestamptz", "accessor": "stbox_tmin", "source": "box"},
          {"name": "tmax", "sqlType": "timestamptz", "accessor": "stbox_tmax", "source": "box"}
        ]}
      ],
      "columns": [
        {"name": "srid", "sqlType": "int", "accessor": "tspatial_srid", "source": "value"}
      ]
    },
    "number": {
      "doc": "Numeric temporal types — TBOX covering: the value range and the time extent.",
      "box": {"type": "TBOX", "from": "tnumber_to_tbox"},
      "srid": null,
      "types": ["tint", "tfloat", "tbigint"],
      "coverings": [
        {"key": "vspan", "column": "{col}_vspan", "fields": [
          {"name": "vmin", "sqlType": "double", "accessor": "tbox_xmin", "source": "box"},
          {"name": "vmax", "sqlType": "double", "accessor": "tbox_xmax", "source": "box"}
        ]},
        {"key": "tspan", "column": "{col}_tspan", "fields": [
          {"name": "tmin", "sqlType": "timestamptz", "accessor": "tbox_tmin", "source": "box"},
          {"name": "tmax", "sqlType": "timestamptz", "accessor": "tbox_tmax", "source": "box"}
        ]}
      ],
      "columns": []
    },
    "timeOnly": {
      "doc": "Time-only temporal types — no box; the time extent only.",
      "box": null,
      "srid": null,
      "types": ["tbool", "ttext"],
      "coverings": [
        {"key": "tspan", "column": "{col}_tspan", "fields": [
          {"name": "tmin", "sqlType": "timestamptz", "accessor": "temporal_start_timestamptz", "source": "value"},
          {"name": "tmax", "sqlType": "timestamptz", "accessor": "temporal_end_timestamptz", "source": "value"}
        ]}
      ],
      "columns": []
    }
  },
  "deferred": {
    "pointcloudCellIndex": {
      "types": ["tpcpoint", "tpcpatch", "th3index", "tquadbin"],
      "reason": "STBOX covering via a type-specific box path (e.g. tpcbox_to_stbox); fold into the `spatial` class once the catalog confirms a uniform temporal->STBOX converter for these families."
    }
  },
  "notes": [
    "The covering columns are a denormalisation of the value's bounding box; the canonical MEOS-WKB BLOB remains the lossless source of truth.",
    "Each covering is a struct column at the root of the schema; `{col}` in its `column` is the name of the temporal column it covers. The statistics of its fields give Iceberg manifest-level file pruning and Parquet row-group min/max pruning, with no spatial-aware engine.",
    "The `bbox` covering is a GeoParquet bounding box column: its fields are DOUBLE, in the order xmin, ymin, [zmin,] xmax, ymax[, zmax], it has the repetition of its temporal column, and it holds a value exactly when the temporal column does.",
    "zmin/zmax are emitted only for 3D values (`when: hasZ`); the bbox of a 2D value has four fields.",
    "`columns` are plain columns at the root beside the coverings; the spatial class carries `srid` there.",
    "`source: box` accessors take the box returned by `class.box.from(value)`; `source: value` accessors take the temporal value directly.",
    "This descriptor is type-agnostic per class exactly as `portable-aliases.json` is type-agnostic per operator family — codegen consumes it identically across every binding."
  ]
}
